name,id,demand class,base price,export value,price variability,utility,origin,tags,stack size,cargo space,icon,sound id,sound id drop,order,economyTier,econUnitOrigUnused,econUnit,baseRaidDanger,eU * base value,iconWidthMult,plugin,desc
Light Machinery,light_machinery,industry,90,300,3,1,,,1500,1,graphics/icons/cargo/light_machinery_1.png,ui_cargo_machinery,ui_cargo_machinery_drop,6,3,,400,MEDIUM,36000,1,,"Precision-engineered machines and tools used in light manufacturing and assembly. Essential for producing consumer goods and smaller-scale industrial components."
Structural Components,components_structural,components_structural,60,200,3,1,,structural,2000,1,graphics/icons/cargo/components_structural_1.png,ui_cargo_supplies,ui_cargo_supplies_drop,7,3,,750,MEDIUM,45000,1,,"Bulk structural parts and frames used in heavy assemblies and substructures."
Precision Components,components_precision,components_precision,120,350,3,1,,expensive,1000,1,graphics/icons/cargo/components_precision_1.png,ui_cargo_supplies,ui_cargo_supplies_drop,8,3,,400,MEDIUM,48000,1,,"High-precision machined parts made from rare metals, essential for advanced systems and precision-heavy assemblies. Used in the manufacture of components for machinery, electronics, and specialized equipment requiring exact tolerances and durability."
Subassembly Parts,components_subassembly,components_subassembly,90,250,3,1,,subassembly,1500,1,graphics/icons/cargo/components_subassembly_1.png,ui_cargo_supplies,ui_cargo_supplies_drop,9,3,,600,MEDIUM,54000,1,,"Pre-assembled modules combining light and precision components. Ready for final assembly."
Light Components,components_light,components_light,45,150,3,1,,,2500,1,graphics/icons/cargo/components_light_1.png,ui_cargo_supplies,ui_cargo_supplies_drop,10,3,,900,,40500,1,,"Light, labor-intensive components used in consumer goods and light industrial products. Forms the backbone of everyday manufacturing and assembly."